{
  "documentation": "Rules to make the game similar to Warlords II.",
  "armyGroupSizeMax": 8,
  "armyHealthMax": 10,
  "armyHealthMin": 1,
  "armyHealthModifierMax": 4,
  "armyHealthModifierMin": -2,
  "armyStrengthMax": 15,
  "armyStrengthMin": 0,
  "armyStrengthModifierMax": 5,
  "armyStrengthModifierMin": -5,
  "battleDiceNumFaces": 20,
  "heroesMax": 5,
  "name": "sequel"
}
