{
  "documentation": "Rules and configuration options to make the game as similar to the original Warlords as possible.",
  "armyGroupSizeMax": 8,
  "battleDiceNumFaces": 10,
  "heroesMax": 5,
  "name": "classic",
  "armyStrengthMax": 9,
  "armyStrengthMin": 0,
  "armyStrengthModifierMax": 10000,
  "armyStrengthModifierMin": -10000
}
